{
  "title": "Returned Task Documentation",
  "description": "The XML documentation for a returned asynchronous Task.",
  "scope": "csharp",
  "body": [
    "/// <returns>",
    "/// The <see cref=\"Task\"/> that represents the asynchronous operation,",
    "/// containing the $0",
    "/// </returns>"
  ]
}
